{
  "lead_id": "hk_8x2k1f",
  "timestamp": "2026-06-10T09:30:00Z",
  "source": "hk-app-radar",
  "status": "qualifiziert",
  "area": "Gummersbach",
  "category": "Zahnärzte",
  "company": {
    "name": "Zahnarztpraxis Dr. Beispiel",
    "address": "Hauptstraße 12, 51643 Gummersbach",
    "phone": "+49 2261 123456",
    "website": "",
    "instagram": "",
    "facebook": ""
  },
  "signale": {
    "score": 2,
    "priority": "A",
    "hot": true,
    "gaps": ["keine Website", "keine Social-Media-Profile"],
    "reason": "keine Website, keine Social-Media-Profile — Ansatzpunkt für Website · Social Media · HK Wachstums-Check."
  },
  "services": [
    { "id": "website", "label": "Website" },
    { "id": "social", "label": "Social Media" },
    { "id": "check", "label": "HK Wachstums-Check" }
  ],
  "meta": { "raw": {} }
}
